MCQ,Choices,Correct
What is the scientific study of life called?,a: Chemistry | b: Biology | c: Physics | d: Geology,b
Which theme in biology explains the unity and diversity of life?,a: Evolution | b: Photosynthesis | c: Mitosis | d: Respiration,a
"What allows organisms to move, grow, and reproduce?",a: Energy processing | b: Genetic mutation | c: Cell division | d: Photosynthesis,a
"What is the process by which biologists make observations, pose questions, and form conclusions?",a: Scientific method | b: Guessing game | c: Magic | d: Intuition,a
How long ago did life on Earth emerge?,a: 1 million years ago | b: 100 million years ago | c: 1 billion years ago | d: 3.7 billion years ago,d
